的,de,de,"possessive, adjectival suffix"
一,yī,yi,"one; a, an; alone"
是,shì,shi,"indeed, yes, right; to be; demonstrative pronoun, this, that"
不,bù,bu,"no, not; un-; negative prefix"
了,le,le,to finish; particle of completed action
在,zài,zai,"be at, in, on; consist in, rest"
人,rén,ren,man; people; mankind; someone else
有,yǒu,you,"have, own, possess; exist"
我,wǒ,wo,"our, us, i, me, my, we"
他,tā,ta,"other, another; he, she, it"
这,zhè,zhe,"this, the, here"
个,gè,ge,"numerary adjunct, piece; single"
们,men,men,adjunct pronoun indicate plural
中,zhōng,zhong,"central; center, middle; in the midst of; hit (target); attain"
来,lái,lai,"come, coming; return, returning"
上,shàng,shang,"top; superior, highest; go up, send up"
大,dà,da,"big, great, vast, large, high"
为,wèi,wei,"do, handle, govern, act; be"
和,hé,he,"harmony, peace; peaceful, calm"
国,guó,guo,"nation, country, nation-state"
地,de,de,"earth; soil, ground; region"
到,dào,dao,"go to, arrive, been to"
以,yǐ,yi,"by means of; thereby, therefore; consider as; in order to"
说,shuō,shuo,"speak, say, talk; scold, upbraid"
时,shí,shi,"time, season; era, age, period"
要,yào,yao,"necessary, essential; necessity"
就,jiù,jiu,"just, simply; to come, go to; to approach, near"
出,chū,chu,"go out, send out; stand; produce"
会,huì,hui,"assemble, meet together; meeting"
可,kě,ke,"may, can, -able; possibly"
也,yě,ye,also; classical final particle of strong affirmation or identity
你,nǐ,ni,"you, second person pronoun"
对,duì,dui,"correct, right; facing, opposed"
生,shēng,sheng,"life, living, lifetime; birth"
能,néng,neng,"to be able; can, permitted to; ability"
而,ér,er,and; and then; and yet; but
子,zi,zi,"offspring, child; fruit, seed of; 1st terrestrial branch"
那,nà,na,"that, that one, those"
得,dé,de,"obtain, get, gain, acquire"
于,yú,yu,"in, on, at; go to; surname"
着,zhe,zhe,"make move, take action"
下,xià,xia,"under, underneath, below; down; inferior; bring down"
自,zì,zi,"self, private, personal; from"
之,zhī,zhi,"marks preceding phrase as modifier of following phrase; it, him her, them; go to"
年,nián,nian,
过,guò,guo,"pass, pass through, go across"
发,fā,fa,"issue, dispatch, send out; hair"
后,hòu,hou,"queen, empress, sovereign; (simp. for 後) behind, rear, after"
作,zuò,zuo,"make; work; compose, write; act, perform"
里,lǐ,li,unit of distance; village; lane
用,yòng,yong,"use, employ, apply, operate; use"
道,dào,dao,"path, road, street; method, way"
行,xíng,xing,"go; walk; move, travel; circulate"
所,suǒ,suo,"place, location; numerary adjunct"
然,rán,ran,"yes, certainly; pledge, promise"
家,jiā,jia,"house, home, residence; family"
种,zhǒng,zhong,"seed; race, breed; to plant"
事,shì,shi,"affair, matter, business; to serve; accident, incident"
成,chéng,cheng,"completed, finished, fixed"
方,fāng,fang,"a square, rectangle; a region; local"
多,duō,duo,"much, many; more than, over"
经,jīng,jing,classic works; pass through
么,me,me,interrogative particle; repetition of a tune small; tender
去,qù,qu,"go away, leave, depart"
法,fǎ,fa,"law, rule, regulation, statute; France, French"
学,xué,xue,"learning, knowledge; school"
如,rú,ru,"if, supposing; as if; like, as"
都,dōu,dou,"metropolis, capital; all, the whole; elegant, refined"
同,tóng,tong,"same, similar; together with"
现,xiàn,xian,"appear, manifest, become visible"
当,dāng,dang,"bear, accept, undertake; just"
没,méi,mei,"not, have not, none; drown, sink"
动,dòng,dong,"move, happen; movement, action"
面,miàn,mian,"face; surface; plane; side, dimension"
起,qǐ,qi,"rise, stand up; go up; begin"
看,kàn,kan,"look, see; examine, scrutinize"
定,dìng,ding,"decide, settle, fix"
天,tiān,tian,"sky, heaven; god, celestial"
分,fēn,fen,divide; small unit of time etc.
还,hái,hai,"still, yet, also, besides"
进,jìn,jin,"advance, make progress, enter"
好,hǎo,hao,"good, excellent, fine; well"
小,xiǎo,xiao,"small, tiny, insignificant"
部,bù,bu,"part, division, section"
其,qí,qi,"his, her, its, their; that"
些,xiē,xie,"little, few; rather, somewhat"
主,zhǔ,zhu,"master, chief owner; host; lord"
样,yàng,yang,"shape, form, pattern, style"
理,lǐ,li,"reason, logic; manage"
心,xīn,xin,"heart; mind, intelligence; soul"
她,tā,ta,"she, her"
本,běn,ben,"root, origin, source; basis"
前,qián,qian,"in front, forward; preceding"
开,kāi,kai,"open; initiate, begin, start"
但,dàn,dan,"only; but, however, yet, still"
因,yīn,yin,"cause, reason; by; because (of)"
只,zhǐ,zhi,"only, just, simply"
从,cóng,cong,"from, by, since, whence, through"
想,xiǎng,xiang,"think, speculate, plan, consider"
实,shí,shi,"real, true; honest, sincere"
日,rì,ri,sun; day; daytime
军,jūn,jun,"army, military; soldiers, troops"
者,zhě,zhe,that which; he who; those who
意,yì,yi,"thought, idea, opinion; think"
无,wú,wu,"negative, no, not; KangXi radical 71"
力,lì,li,"power, capability, influence"
它,tā,ta,it; other
与,yǔ,yu,"and; with; to; for; give, grant"
长,zhǎng,zhang,long; length; excel in; leader
把,bǎ,ba,"hold, take; guard; regard as"
机,jī,ji,desk; machine; moment
十,shí,shi,"ten, tenth; complete; perfect"
民,mín,min,"people, subjects, citizens"
第,dì,di,"sequence, number; grade, degree"
公,gōng,gong,"fair, equitable; public; duke"
此,cǐ,ci,"this, these; in this case, then"
已,yǐ,yi,already; finished; stop
工,gōng,gong,"labor, work; worker, laborer"
使,shǐ,shi,"cause, send on a mission, order; envoy, messenger, ambassador"
情,qíng,qing,"feeling, sentiment, emotion"
明,míng,ming,"bright, light, brilliant; clear"
性,xìng,xing,"nature, character, sex"
知,zhī,zhi,"know, perceive, comprehend"
全,quán,quan,"maintain, keep whole or intact"
三,sān,san,three
又,yòu,you,"and, also, again, in addition"
关,guān,guan,frontier pass; close; relation
点,diǎn,dian,"dot, speck, spot; point, degree"
正,zhèng,zheng,"right, proper, correct"
业,yè,ye,"profession, business; GB radical 111"
外,wài,wai,"out, outside, external; foreign"
将,jiāng,jiang,"will, going to, future; general"
两,liǎng,liang,"two, both, pair, couple; ounce"
高,gāo,gao,"high, tall; lofty, elevated"
间,jiān,jian,"midpoint, space; place, locality"
由,yóu,you,"cause, reason; from"
问,wèn,wen,"ask about, inquire after"
很,hěn,hen,"very, quite, much"
最,zuì,zui,"most, extremely, exceedingly"
重,zhòng,zhong,"heavy, weighty; double"
并,bìng,bing,
物,wù,wu,"thing, substance, creature"
手,shǒu,shou,hand
应,yīng,ying,"should, ought to, must"
战,zhàn,zhan,"war, fighting, battle"
向,xiàng,xiang,"toward, direction, trend"
头,tóu,tou,"head; top; chief, first; boss"
文,wén,wen,"literature, culture, writing"
体,tǐ,ti,"body; group, class, body, unit; inferior"
政,zhèng,zheng,"government, political affairs"
美,měi,mei,"beautiful, pretty; pleasing"
相,xiāng,xiang,"mutual, reciprocal, each other"
见,jiàn,jian,"see, observe, behold; perceive"
被,bèi,bei,
利,lì,li,"gains, advantage, profit, merit"
什,shén,shen,"file of ten soldiers; mixed, miscellaneous"
二,èr,er,two; twice
等,děng,deng,
产,chǎn,chan,"give birth, bring forth, produce"
或,huò,huo,"or, either, else; perhaps, maybe"
新,xīn,xin,"new, recent, fresh, modern"
己,jǐ,ji,"self, oneself; personal, private; 6th heavenly stem"
制,zhì,zhi,system; establish; overpower
身,shēn,shen,"body; trunk, hull; rad. no. 158"
果,guǒ,guo,fruit; result
加,jiā,jia,"add to, increase, augment"
西,xī,xi,"west(ern); westward, occident"
斯,sī,si,"this, thus, such; to lop off; emphatic particle"
月,yuè,yue,moon; month; KangXi radical 74
话,huà,hua,"speech, talk, language; dialect"
合,hé,he,"combine, unite, join; gather"
回,huí,hui,"return, turn around; a time"
特,tè,te,"special, unique, distinguished"
代,dài,dai,"replace, replacement (of person or generation); era, generation"
内,nèi,nei,inside
信,xìn,xin,"trust, believe; letter"
表,biǎo,biao,"show, express, manifest, display"
化,huà,hua,"change, convert, reform; -ize"
老,lǎo,lao,"old, aged; experienced"
给,gěi,gei,"give; by, for"
世,shì,shi,generation; world; era
位,wèi,wei,"throne; position, post; rank, status; seat"
次,cì,ci,"order, sequence; next"
度,dù,du,"degree, system; manner; to consider"
门,mén,men,"gate, door, entrance, opening"
任,rèn,ren,"trust to, rely on, appoint; to bear, duty, office; allow"
常,cháng,chang,"common, normal, frequent, regular"
先,xiān,xian,"first, former, previous"
海,hǎi,hai,"sea, ocean; maritime"
通,tōng,tong,"pass through, common, communicate"
教,jiào,jiao,"teach, class"
儿,ér,er,"son, child; KangXi radical 10"
原,yuán,yuan,"source, origin, beginning"
东,dōng,dong,"east, eastern, eastward"
声,shēng,sheng,"sound, voice, noise; tone; music"
提,tí,ti,hold in hand; lift in hand
立,lì,li,"stand; let stand; establish, set"
及,jí,ji,extend; reach; come up to; and
比,bǐ,bi,"to compare, liken; comparison; than"
员,yuán,yuan,"member; personnel, staff member"
解,jiě,jie,"loosen, unfasten, untie; explain"
水,shuǐ,shui,"water, liquid, lotion, juice"
名,míng,ming,"name, rank, title, position"
真,zhēn,zhen,"real, actual, true, genuine"
论,lùn,lun,debate; discuss; discourse
处,chù,chu,"place, locale; department"
走,zǒu,zou,"walk, go on foot; run; leave"
义,yì,yi,"right conduct, righteousness"
各,gè,ge,"each, individually, every, all"
入,rù,ru,"enter, come in(to), join"
几,jǐ,ji,small table
口,kǒu,kou,"mouth; open end; entrance, gate"
认,rèn,ren,"recognize, know, understand"
条,tiáo,tiao,"clause, condition; string, stripe"
平,píng,ping,"flat, level, even; peaceful"
系,xì,xi,"system; line, link, connection"
气,qì,qi,"steam, vapor; KangXi radical 84"
题,tí,ti,"forehead; title, headline; theme"
活,huó,huo,"live, exist, survive; lively"
尔,ěr,er,"you; that, those; final particle"
更,gèng,geng,"more, still further, much more"
别,bié,bie,"separate, other; do not"
打,dǎ,da,"strike, hit, beat; fight; attack"
女,nǚ,nv,"woman, girl; feminine; rad. 38"
变,biàn,bian,"change, transform, alter; rebel"
四,sì,si,four
神,shén,shen,"spirit, god, supernatural being"
总,zǒng,zong,"collect; overall, altogether"
何,hé,he,"what, why, where, which, how"
电,diàn,dian,electricity; electric; lightning
数,shù,shu,"number; several, count; fate"
安,ān,an,"peaceful, tranquil, quiet"
少,shǎo,shao,"few, less, inadequate"
报,bào,bao,"report, tell, announce"
才,cái,cai,"talent, ability; just, only"
结,jié,jie,"knot, tie; join, connect"
反,fǎn,fan,"reverse, opposite, contrary, anti"
受,shòu,shou,"receive, accept, get; bear, stand"
目,mù,mu,"eye; look, see; division, topic"
太,tài,tai,"very, too, much; big; extreme"
量,liàng,liang,"measure, quantity, capacity"
再,zài,zai,"again, twice, re-"
感,gǎn,gan,"feel, perceive, emotion"
建,jiàn,jian,"build, establish, erect, found"
务,wù,wu,"affairs, business; must, should"
做,zuò,zuo,"work, make; act"
接,jiē,jie,receive; continue; catch; connect
必,bì,bi,"surely, most certainly; must"
场,chǎng,chang,"open space, field, market"
件,jiàn,jian,numerary adjunct for article; matter
计,jì,ji,"plan, plot; strategem; scheme"
管,guǎn,guan,"pipe, tube, duct; woodwind music"
期,qī,qi,period of time; date; time limit
市,shì,shi,"market, fair; city, town; trade"
直,zhí,zhi,"straight, erect, vertical"
德,dé,de,"ethics, morality, virtue"
资,zī,zi,property; wealth; capital
命,mìng,ming,"life; destiny, fate, luck; an order, instruction"
山,shān,shan,"mountain, hill, peak"
金,jīn,jin,gold; metals in general; money
指,zhǐ,zhi,"finger, toe; point, indicate"
克,kè,ke,gram; overcome; transliteration
许,xǔ,xu,"allow, permit; promise; betroth"
统,tǒng,tong,"govern, command, control; unite"
区,qū,qu,"area, district, region, ward"
保,bǎo,bao,"protect, safeguard, defend, care"
至,zhì,zhi,"reach, arrive; extremely, very"
队,duì,dui,"team, group; army unit"
形,xíng,xing,"form, shape, appearance"
社,shè,she,"god of the soil and altars to him; group of families; company, society"
便,biàn,bian,"convenience, ease; expedient"
空,kōng,kong,"empty, hollow, bare, deserted"
决,jué,jue,"decide, determine, judge"
治,zhì,zhi,"govern, regulate, administer"
展,zhǎn,zhan,"open, unfold; stretch, extend"
马,mǎ,ma,horse; surname; KangXi radical 187
科,kē,ke,"section, department, science"
司,sī,si,"take charge of, control, manage; officer"
五,wǔ,wu,five; surname
基,jī,ji,"foundation, base"
眼,yǎn,yan,"eye; eyelet, hole, opening"
书,shū,shu,"book, letter, document; writings"
非,fēi,fei,"not, negative, non-; oppose"
则,zé,ze,"rule, law, regulation; grades"
听,tīng,ting,"hear; understand; obey, comply"
白,bái,bai,"white; pure, unblemished; bright"
却,què,que,"still, but; decline; retreat"
界,jiè,jie,"boundary, limit; domain; society; the world"
达,dá,da,"arrive at, reach; intelligent; smooth, slippery"
光,guāng,guang,"light, brilliant, shine; only"
放,fàng,fang,"put, release, free, liberate"
强,qiáng,qiang,"strong, powerful, energetic"
即,jí,ji,"promptly, quickly, immediately"
像,xiàng,xiang,"a picture, image, figure; to resemble"
难,nán,nan,"difficult, arduous, hard; unable"
且,qiě,qie,"moreover, also (post-subject); about to, will soon (pre-verb)"
权,quán,quan,"power, right, authority"
思,sī,si,"think, consider, ponder; final particle"
王,wáng,wang,"king, ruler; royal; surname"
象,xiàng,xiang,"elephant; ivory; figure, image"
完,wán,wan,"complete, finish, settle; whole"
设,shè,she,build; establish; display
式,shì,shi,"style, system, formula, rule"
色,sè,se,"color, tint, hue, shade; form, body; beauty, desire for beauty"
路,lù,lu,"road, path, street; journey"
记,jì,ji,"record; keep in mind, remember"
南,nán,nan,south; southern part; southward
品,pǐn,pin,"article, product, commodity"
住,zhù,zhu,"reside, live at, dwell, lodge; stop"
告,gào,gao,"tell, announce, inform; accuse"
类,lèi,lei,"class, group, kind, category"
求,qiú,qiu,"seek; demand, request; beseech"
据,jù,ju,"to occupy, take possession of; a base, position"
程,chéng,cheng,"journey, trip; schedule, agenda"
北,běi,bei,north; northern; northward
边,biān,bian,"edge, margin, side, border"
死,sǐ,si,die; dead; death
张,zhāng,zhang,"stretch, extend, expand; sheet"
该,gāi,gai,"should, ought to, need to"
交,jiāo,jiao,"mix; intersect; exchange, communicate; deliver"
规,guī,gui,"rules, regulations, customs, law"
万,wàn,wan,ten thousand; innumerable
取,qǔ,qu,"take, receive, obtain; select"
拉,lā,la,"pull, drag; seize, hold; lengthen"
格,gé,ge,"pattern, standard, form; style"
望,wàng,wang,"to look at, look forward; to hope, expect"
觉,jué,jue,to wake up from sleep; conscious
术,shù,shu,"art, skill, special feat; method, technique"
领,lǐng,ling,"neck; collar; lead, guide"
共,gòng,gong,"together with, all, total; to share"
确,què,que,"sure, certain; real, true"
传,chuán,chuan,"summon; propagate, transmit"
师,shī,shi,"teacher, master, specialist"
观,guān,guan,"see, observe, view; appearance"
清,qīng,qing,"clear, pure, clean; peaceful"
今,jīn,jin,"now, today, modern era"
切,qiè,qie,"cut, mince, slice, carve"
院,yuàn,yuan,"courtyard, yard, court; school"
让,ràng,rang,"allow, permit, yield, concede"
识,shí,shi,"recognize, understand, know"
候,hòu,hou,wait; expect; visit; greet
带,dài,dai,"belt, girdle, band, strap, zone"
导,dǎo,dao,"direct, guide, lead, conduct"
争,zhēng,zheng,"dispute, fight, contend, strive"
运,yùn,yun,"run; simplified form of 運 luck, fortune; ship, transport"
笑,xiào,xiao,"smile, laugh, giggle; snicker"
飞,fēi,fei,fly; go quickly; dart; high
风,fēng,feng,"wind; air; manners, atmosphere"
步,bù,bu,"step, pace; walk, stroll"
改,gǎi,gai,"change, alter; improve, remodel"
收,shōu,shou,"gather together, collect; harvest"
根,gēn,gen,"root, base(d on); foundation"
干,gàn,gan,"oppose, offend; invade; dried"
造,zào,zao,"construct, build, make, begin; prepare"
言,yán,yan,"words, speech; speak, say"
联,lián,lian,"connect, join; associate, ally"
持,chí,chi,"sustain, support; hold, grasp"
组,zǔ,zu,"class; section, department"
每,měi,mei,"every, each"
济,jì,ji,"help, aid, relieve; ferry, cross"
车,chē,che,"cart, vehicle; carry in cart"
亲,qīn,qin,"relatives, parents; intimate the hazel nut or filbert tree a thorny tree"
极,jí,ji,"extreme, utmost, furthest, final"
林,lín,lin,"forest, grove; surname"
服,fú,fu,"clothes; wear, dress"
快,kuài,kuai,"rapid, quick, speedy, fast; soon"
办,bàn,ban,"manage, do, handle; deal with"
议,yì,yi,"consult, talk over, discuss"
往,wǎng,wang,"go, depart; past, formerly"
元,yuán,yuan,first; dollar; origin; head
英,yīng,ying,"petal, flower, leaf; brave, a hero; England, English"
士,shì,shi,"scholar, gentleman; soldier"
证,zhèng,zheng,"prove, confirm, verify; proof"
近,jìn,jin,"near, close; approach; intimate"
失,shī,shi,"lose; make mistake, neglect"
转,zhuǎn,zhuan,"shift, move, turn"
夫,fū,fu,"man, male adult, husband; those"
令,lìng,ling,
准,zhǔn,zhun,"approve, allow, permit; in accord"
布,bù,bu,"cotton cloth, textiles, linen"
始,shǐ,shi,"begin, start; then, only then"
怎,zěn,zen,what? why? how?
呢,ne,ne,interrogative or emphatic final; (Cant.) this
存,cún,cun,"exist, live, be; survive; remain"
未,wèi,wei,not yet; 8th terrestrial branch
远,yuǎn,yuan,"distant, remote, far; profound"
叫,jiào,jiao,"cry, shout; hail, greet, call"
台,tái,tai,platform; unit; term of address
单,dān,dan,"single, individual, only; lone"
影,yǐng,ying,"shadow; image, reflection; photograph"
具,jù,ju,"tool, implement; draw up, write"
罗,luō,luo,net for catching birds; gauze
字,zì,zi,"letter, character, word"
爱,ài,ai,"love, be fond of, like"
击,jī,ji,"strike, hit, beat; attack, fight"
流,liú,liu,"flow, circulate, drift; class"
备,bèi,bei,"prepare, ready, perfect"
兵,bīng,bing,"soldier, troops"
连,lián,lian,"join, connect; continuous; even"
调,diào,diao,"transfer, move, change; tune"
深,shēn,shen,"deep; depth; far; very, extreme"
商,shāng,shang,"commerce, business, trade"
算,suàn,suan,"count, calculate, figure; plan"
质,zhì,zhi,"matter, material, substance"
团,tuán,tuan,"sphere, ball, circle; mass, lump"
集,jí,ji,"assemble, collect together"
百,bǎi,bai,"one hundred; numerous, many"
需,xū,xu,"need, require, must"
价,jià,jia,"price, value"
花,huā,hua,flower; blossoms
党,dǎng,dang,"political party, gang, faction"
华,huá,hua,flowery; illustrious; Chinese
城,chéng,cheng,"castle; city, town; municipality"
石,shí,shi,"stone, rock, mineral; rad. 112"
级,jí,ji,"level, rank, class; grade"
整,zhěng,zheng,"orderly, neat, tidy; whole"
府,fǔ,fu,prefecture; prefect; government
离,lí,li,rare beast; strange; elegant
况,kuàng,kuang,"condition, situation; furthermore"
亚,yà,ya,Asia; second
请,qǐng,qing,"ask, request; invite; please"
技,jì,ji,"skill, ability, talent, ingenuity"
际,jì,ji,"border, boundary, juncture"
约,yuē,yue,"treaty, agreement, covenant"
示,shì,shi,"show, manifest; demonstrate"
复,fù,fu,return; repeat; repeatedly
病,bìng,bing,"illness, sickness, disease"
息,xī,xi,"rest, put stop to, end, cease"
究,jiū,jiu,"examine, investigate"
线,xiàn,xian,"line, thread, wire; clue"
似,shì,shi,"resemble, similar to; as if, seem"
官,guān,guan,"official, public servant"
火,huǒ,huo,"fire, flame; burn; anger, rage"
断,duàn,duan,"sever, cut off; interrupt"
精,jīng,jing,essence; semen; spirit
满,mǎn,man,"fill; full, satisfied"
支,zhī,zhi,"disperse, pay; support; branch"
视,shì,shi,"look at, inspect, observe, see"
消,xiāo,xiao,"vanish, die out; melt away"
越,yuè,yue,"exceed, go beyond; the more ..."
器,qì,qi,"receptacle, vessel; instrument"
容,róng,rong,"looks, appearance; figure, form"
照,zhào,zhao,"shine, illumine, reflect"
须,xū,xu,"must, have to, necessary"
九,jiǔ,jiu,nine
增,zēng,zeng,"increase, add to, augment"
研,yán,yan,"grind, rub; study, research"
写,xiě,xie,"write; draw, sketch; compose"
称,chēng,cheng,"call; name, brand; address; say"
企,qǐ,qi,plan a project; stand on tiptoe
八,bā,ba,"eight; all around, all sides"
功,gōng,gong,"achievement, merit, good result"
吗,ma,ma,final interrogative particle
包,bāo,bao,"wrap, pack, bundle; package"
片,piàn,pian,"slice, splinter, strip; rad. 91"
史,shǐ,shi,"history, chronicle, annals"
委,wěi,wei,"appoint, send, commission"
乎,hū,hu,interrogative or exclamatory final particle
查,chá,cha,"investigate, examine, seek into"
轻,qīng,qing,"light; easy, simple; gentle"
易,yì,yi,change; easy
早,zǎo,zao,early; soon; morning
曾,céng,ceng,already; sign of past
除,chú,chu,"eliminate, remove, except"
农,nóng,nong,"agriculture, farming; farmer"
找,zhǎo,zhao,"search, seek, look for; find"
装,zhuāng,zhuang,"dress, clothes, attire; fill"
广,guǎng,guang,"wide, extensive, broad; rad. 53"
显,xiǎn,xian,"manifest, display; evident, clear"
吧,ba,ba,emphatic final particle
阿,ā,a,
李,lǐ,li,plum; judge; surname
标,biāo,biao,"mark, symbol, label, sign; stand the bole of a tree"
谈,tán,tan,talk; conversation; surname
吃,chī,chi,"eat; drink; suffer, endure, bear"
图,tú,tu,"diagram; chart, map, picture"
念,niàn,nian,"think of, recall, study"
六,liù,liu,number six
引,yǐn,yin,"to pull, draw out, attract; to stretch"
历,lì,li,history; calendar
首,shǒu,shou,"head; first; leader, chief; a poem"
医,yī,yi,"cure, heal; doctor, medical"
局,jú,ju,"bureau, office; circumstance"
突,tū,tu,"suddenly, abruptly, unexpectedly"
专,zhuān,zhuan,"monopolize, take sole possession"
费,fèi,fei,"expenses, expenditures, fee"
号,hào,hao,"mark, sign; symbol; number"
尽,jǐn,jin,"exhaust, use up; deplete"
另,lìng,ling,"another, separate, other"
周,zhōu,zhou,Zhou dynasty; circumference
较,jiào,jiao,"compare; comparatively, more"
注,zhù,zhu,"concentrate, focus, direct"
语,yǔ,yu,"language, words; saying, expression"
仅,jǐn,jin,"only, merely, solely, just"
考,kǎo,kao,"examine, test; investigate"
落,luò,luo,"fall, drop; net income, surplus"
青,qīng,qing,"blue, green, black; young"
随,suí,sui,"follow, listen to, submit to"
选,xuǎn,xuan,"choose, select; elect; election"
列,liè,lie,"a line; to arrange in order, classify"
武,wǔ,wu,"military; martial, warlike"
红,hóng,hong,"red, vermillion; blush, flush"
响,xiǎng,xiang,"make sound, make noise; sound"
虽,suī,sui,"although, even if"
推,tuī,tui,"push, expel; push forward"
势,shì,shi,"power, force; tendency"
参,cān,can,"take part in, intervene; ginseng"
希,xī,xi,"rare; hope, expect, strive for"
古,gǔ,gu,"old, classic, ancient"
众,zhòng,zhong,"multitude, crowd; masses, public"
构,gòu,gou,"frame, building, structure"
房,fáng,fang,"house, building; room"
半,bàn,ban,half
节,jié,jie,"knot, node, joint; section"
土,tǔ,tu,"soil, earth; items made of earth"
投,tóu,tou,"throw, cast, fling, pitch; jump"
某,mǒu,mou,certain thing or person
案,àn,an,"table, bench; legal case"
黑,hēi,hei,"black; dark; evil, sinister"
维,wéi,wei,"maintain, preserve, safeguard"
革,gé,ge,"leather, animal hides; rad. 177"
划,huà,hua,to row or paddle boat; to scratch
敌,dí,di,"enemy, foe, rival; resist"
致,zhì,zhi,"send, deliver, present; cause"
陈,chén,chen,"exhibit, display; plead; a surname"
律,lǜ,lv,"statute, principle, regulation"
足,zú,zu,"foot; attain, satisfy, enough"
态,tài,tai,"manner, bearing, attitude"
护,hù,hu,"protect, guard, defend, shelter"
七,qī,qi,seven
兴,xìng,xing,"thrive, prosper, flourish"
派,pài,pai,"school of thought, sect, branch"
孩,hái,hai,"baby, child; children"
验,yàn,yan,"test, examine, inspect; verify"
责,zé,ze,
营,yíng,ying,"encampment, barracks; manage"
星,xīng,xing,"a star, planet; any point of light"
够,gòu,gou,"enough, adequate"
章,zhāng,zhang,"composition; chapter, section"
音,yīn,yin,"sound, tone, pitch, pronunciation"
跟,gēn,gen,"heel; to follow, accompany; with"
志,zhì,zhi,"purpose, will, determination; annals"
底,dǐ,di,"bottom, underneath, underside"
站,zhàn,zhan,"stand up; a stand, station"
严,yán,yan,"strict, rigorous, rigid; stern"
巴,bā,ba,"greatly desire, anxiously hope"
例,lì,li,"precedent, example; regulation"
防,fáng,fang,defend; prevent; embankment
族,zú,zu,"a family clan, ethnic group, tribe"
供,gōng,gong,"supply, provide for; offer in worship"
效,xiào,xiao,"result, effect; effectiveness"
续,xù,xu,"continue, carry on; succeed"
施,shī,shi,"grant, bestow; give; act; name"
留,liú,liu,"stop, halt; stay, detain, keep"
讲,jiǎng,jiang,explain; discuss; talk
型,xíng,xing,"pattern, model, type; law; mold"
